[
  {"schema":"legal-workflow.event.v1","id":"evt-001","appId":"micar-authorization","productId":"authorization-copilot","practiceGroup":"Financial Regulation","featureId":"workflow-studio","eventType":"workflow_started","status":"running","occurredAt":"2026-07-01T09:00:00Z","workflowVersion":1,"workflowRunId":"run-micar-1","timeSavedMs":1800000,"synthetic":true},
  {"schema":"legal-workflow.event.v1","id":"evt-002","appId":"micar-authorization","featureId":"collaboration","eventType":"review_started","status":"review_required","occurredAt":"2026-07-01T09:18:00Z","durationMs":1080000,"reviewerRole":"lawyer","workflowRunId":"run-micar-1","synthetic":true},
  {"schema":"legal-workflow.event.v1","id":"evt-003","appId":"micar-authorization","featureId":"collaboration","eventType":"approved","status":"approved","occurredAt":"2026-07-01T10:05:00Z","durationMs":3900000,"reviewerRole":"lawyer","workflowRunId":"run-micar-1","synthetic":true},
  {"schema":"legal-workflow.event.v1","id":"evt-004","appId":"dora-workbench","featureId":"collaboration","eventType":"comment_opened","status":"open","occurredAt":"2026-07-02T08:00:00Z","reviewerRole":"specialist","synthetic":true},
  {"schema":"legal-workflow.event.v1","id":"evt-005","appId":"dora-workbench","featureId":"collaboration","eventType":"comment_resolved","status":"resolved","occurredAt":"2026-07-02T09:30:00Z","durationMs":5400000,"reviewerRole":"specialist","synthetic":true},
  {"schema":"legal-workflow.event.v1","id":"evt-006","appId":"dora-workbench","featureId":"collaboration","eventType":"lock_conflict","status":"blocked","occurredAt":"2026-07-02T09:31:00Z","synthetic":true},
  {"schema":"legal-workflow.event.v1","id":"evt-007","appId":"horizon-scanner","featureId":"research-plan","eventType":"source_verified","status":"verified","occurredAt":"2026-07-03T12:00:00Z","reviewerRole":"regulatory_counsel","synthetic":true},
  {"schema":"legal-workflow.event.v1","id":"evt-008","appId":"strategy-os","featureId":"evidence-editor","eventType":"review_reopened","status":"review_required","occurredAt":"2026-07-04T08:00:00Z","reviewerRole":"editor","synthetic":true},
  {"schema":"legal-workflow.event.v1","id":"evt-009","appId":"strategy-os","featureId":"client-portal","eventType":"share_created","status":"active","occurredAt":"2026-07-05T08:00:00Z","resourceCount":3,"expiresAt":"2026-08-05T08:00:00Z","guestAccess":true,"accessReviewDueAt":"2026-07-12T08:00:00Z","synthetic":true},
  {"schema":"legal-workflow.event.v1","id":"evt-010","appId":"regulatory-compliance-os","featureId":"client-portal","eventType":"share_created","status":"active","occurredAt":"2026-07-05T09:00:00Z","resourceCount":28,"expiresAt":"2027-07-05T09:00:00Z","guestAccess":true,"accessReviewDueAt":"2026-08-05T09:00:00Z","synthetic":true},
  {"schema":"legal-workflow.event.v1","id":"evt-011","appId":"eu-ai-act-classifier","featureId":"policy-workflow","eventType":"workflow_blocked","status":"blocked","occurredAt":"2026-07-06T09:00:00Z","workflowVersion":1,"synthetic":true},
  {"schema":"legal-workflow.event.v1","id":"evt-012","appId":"legal-ops-agent","featureId":"matter-list","eventType":"approved","status":"approved","occurredAt":"2026-07-07T09:00:00Z","durationMs":7200000,"reviewerRole":"general_counsel","synthetic":true}
]
